{
  "protocolVersion": "1.0",
  "extensions": [
    {
      "id": "cardworld-engine-profile",
      "version": "1.0.0",
      "module": "agent-harness/consumers/cardworld-engine"
    },
    {
      "id": "codex-runtime",
      "version": "1.0.0",
      "module": "agent-harness/extensions/codex-runtime"
    }
  ],
  "project": {
    "generatorExtensionId": "cardworld-engine-profile",
    "input": {
      "id": "cardworld-engine",
      "workspaceRoot": "/workspaces/CardWorld",
      "maxConcurrency": 1
    }
  },
  "binding": {
    "projectId": "cardworld-engine",
    "profileId": "engine-delivery",
    "extensionId": "cardworld-engine-profile",
    "workspaceRoot": "/workspaces/CardWorld"
  }
}
